{
 "schema_version": "1.0",
 "contract_version": "1.8.1",
 "generated_at": "2026-10-24",
 "source": {
  "matches": 143,
  "rounds": 2931,
  "maps": [
   "de_ancient",
   "de_anubis",
   "de_cache",
   "de_dust2",
   "de_inferno",
   "de_mirage",
   "de_nuke"
  ]
 },
 "definitions": {
  "pistol_rounds": [
   1,
   13
  ],
  "buy_types": [
   "pistol",
   "eco",
   "force",
   "full"
  ],
  "buy_type_rule": "round em pistol_rounds -> 'pistol'; senão pelo valor médio de equipamento por jogador no fim do freeze time: < 1500 'eco', < 3500 'force', senão 'full'",
  "round_time_s": 115.0,
  "bomb_timer_s": 41.0
 },
 "win_probability": {
  "model": "logistic",
  "clock": {
   "round_s": 115.0,
   "bomb_s": 41.0
  },
  "equip_offset": 500.0,
  "hard_rules": [
   "alive_ct == 0 -> 0.0",
   "alive_t == 0 and not bomb_planted -> 1.0"
  ],
  "features": [
   {
    "name": "alive_diff",
    "definition": "alive_ct - alive_t"
   },
   {
    "name": "alive_ct",
    "definition": "alive_ct"
   },
   {
    "name": "alive_t",
    "definition": "alive_t"
   },
   {
    "name": "planted",
    "definition": "1 se a bomba foi plantada, senão 0"
   },
   {
    "name": "planted_x_alive_diff",
    "definition": "planted * alive_diff"
   },
   {
    "name": "clock_unplanted",
    "definition": "(1 - planted) * clock, com clock = clamp((round_s - round_time_s) / round_s, 0, 1)"
   },
   {
    "name": "clock_planted",
    "definition": "planted * clock, com clock = clamp((bomb_s - time_since_plant_s) / bomb_s, 0, 1)"
   },
   {
    "name": "equip_log_ratio",
    "definition": "ln((ct_equip_avg + equip_offset) / (t_equip_avg + equip_offset))"
   }
  ],
  "formula": "p_ct = sigmoid(intercept + map_intercepts[map] + sum(coefficients[f] * f))",
  "intercept": -0.08239497,
  "coefficients": {
   "alive_diff": 0.84906097,
   "alive_ct": 0.41258318,
   "alive_t": -0.43647779,
   "planted": -2.34453652,
   "planted_x_alive_diff": 0.78717873,
   "clock_unplanted": 0.1996044,
   "clock_planted": 1.65084971,
   "equip_log_ratio": 1.42481255
  },
  "map_intercepts": {
   "de_ancient": -0.16668333,
   "de_anubis": 0.06672914,
   "de_cache": 0.06704465,
   "de_dust2": -0.13480166,
   "de_inferno": -0.07042811,
   "de_mirage": 0.03697007,
   "de_nuke": 0.120621
  },
  "unknown_map_intercept": 0.0,
  "evaluation": {
   "method": "validação cruzada de 5 partes agrupada por partida, 268289 estados de 143 partidas; C=1.0",
   "model": {
    "log_loss": 0.4599,
    "brier": 0.1545,
    "auc": 0.8539
   },
   "baseline_vivos_e_plant": {
    "log_loss": 0.5088,
    "brier": 0.1748,
    "auc": 0.7925
   },
   "constant_50": {
    "log_loss": 0.6931,
    "brier": 0.25,
    "auc": 0.5
   },
   "calibration": [
    {
     "predicted": 0.029,
     "observed": 0.025,
     "n": 43552
    },
    {
     "predicted": 0.154,
     "observed": 0.136,
     "n": 15326
    },
    {
     "predicted": 0.249,
     "observed": 0.269,
     "n": 19562
    },
    {
     "predicted": 0.349,
     "observed": 0.312,
     "n": 12675
    },
    {
     "predicted": 0.46,
     "observed": 0.507,
     "n": 35469
    },
    {
     "predicted": 0.544,
     "observed": 0.557,
     "n": 42526
    },
    {
     "predicted": 0.645,
     "observed": 0.638,
     "n": 16197
    },
    {
     "predicted": 0.756,
     "observed": 0.73,
     "n": 21502
    },
    {
     "predicted": 0.844,
     "observed": 0.821,
     "n": 20889
    },
    {
     "predicted": 0.954,
     "observed": 0.956,
     "n": 40591
    }
   ]
  }
 },
 "buy": {
  "resource_edges": [
   2500,
   3500,
   4500,
   5500,
   6500,
   7500
  ],
  "resource_labels": [
   "<2500",
   "2500-3500",
   "3500-4500",
   "4500-5500",
   "5500-6500",
   "6500-7500",
   "7500+"
  ],
  "type_distribution": {
   "CT": {
    "<2500": {
     "eco": 0.2873,
     "force": 0.6726,
     "full": 0.0402
    },
    "2500-3500": {
     "eco": 0.4397,
     "force": 0.5416,
     "full": 0.0187
    },
    "3500-4500": {
     "eco": 0.127,
     "force": 0.3652,
     "full": 0.5078
    },
    "4500-5500": {
     "eco": 0.0008,
     "force": 0.0853,
     "full": 0.9139
    },
    "5500-6500": {
     "eco": 0.001,
     "force": 0.0115,
     "full": 0.9876
    },
    "6500-7500": {
     "eco": 0.001,
     "force": 0.0021,
     "full": 0.9968
    },
    "7500+": {
     "eco": 0.0003,
     "force": 0.0005,
     "full": 0.9992
    }
   },
   "T": {
    "<2500": {
     "eco": 0.7057,
     "force": 0.2744,
     "full": 0.0199
    },
    "2500-3500": {
     "eco": 0.4187,
     "force": 0.5642,
     "full": 0.017
    },
    "3500-4500": {
     "eco": 0.0271,
     "force": 0.2919,
     "full": 0.681
    },
    "4500-5500": {
     "eco": 0.001,
     "force": 0.0115,
     "full": 0.9875
    },
    "5500-6500": {
     "eco": 0.0017,
     "force": 0.0023,
     "full": 0.9961
    },
    "6500-7500": {
     "eco": 0.0018,
     "force": 0.0024,
     "full": 0.9959
    },
    "7500+": {
     "eco": 0.0008,
     "force": 0.0011,
     "full": 0.9981
    }
   }
  },
  "type_distribution_n": {
   "CT": {
    "<2500": 97,
    "2500-3500": 214,
    "3500-4500": 265,
    "4500-5500": 377,
    "5500-6500": 309,
    "6500-7500": 281,
    "7500+": 1108
   },
   "T": {
    "<2500": 187,
    "2500-3500": 278,
    "3500-4500": 494,
    "4500-5500": 491,
    "5500-6500": 297,
    "6500-7500": 280,
    "7500+": 624
   }
  },
  "prior_strength": 5,
  "note": "Recursos = média por jogador do time de (dinheiro + valor do equipamento já carregado) no início da fase de compra. Round de pistola (1 e 13): sempre 'pistol'.",
  "loadouts": {
   "CT": {
    "eco": {
     "player_rounds": 795,
     "armor_rate": 0.1937,
     "helmet_rate": 0.0403,
     "kit_rate": 0.0025,
     "primary_rate": 0.0566,
     "primary_share": {
      "m4a1_silencer": 0.2,
      "mp9": 0.2,
      "ssg08": 0.1778,
      "galilar": 0.0889,
      "ak47": 0.0667,
      "famas": 0.0667,
      "mp7": 0.0667,
      "mag7": 0.0667
     },
     "secondary_share": {
      "usp_silencer": 0.5152,
      "deagle": 0.2215,
      "fiveseven": 0.1734,
      "p250": 0.062,
      "hkp2000": 0.0253
     },
     "awp_per_team": 0.0063,
     "grenades_per_player": {
      "smoke": 0.195,
      "flash": 0.0956,
      "he": 0.0893,
      "molotov": 0.0075
     },
     "equip_value": {
      "p10": 200,
      "p50": 500,
      "p90": 1650
     }
    },
    "force": {
     "player_rounds": 1595,
     "armor_rate": 0.8596,
     "helmet_rate": 0.306,
     "kit_rate": 0.0238,
     "primary_rate": 0.4502,
     "primary_share": {
      "mp9": 0.429,
      "ssg08": 0.1323,
      "m4a1_silencer": 0.1309,
      "famas": 0.1031,
      "awp": 0.0613,
      "m4a1": 0.0474,
      "mp7": 0.0292,
      "mag7": 0.0279
     },
     "secondary_share": {
      "usp_silencer": 0.4767,
      "fiveseven": 0.2997,
      "deagle": 0.1612,
      "p250": 0.0258,
      "hkp2000": 0.0233
     },
     "awp_per_team": 0.1379,
     "grenades_per_player": {
      "smoke": 0.674,
      "flash": 0.3893,
      "he": 0.294,
      "molotov": 0.0639
     },
     "equip_value": {
      "p10": 1000,
      "p50": 2150,
      "p90": 4050
     }
    },
    "full": {
     "player_rounds": 10865,
     "armor_rate": 0.9967,
     "helmet_rate": 0.7727,
     "kit_rate": 0.5079,
     "primary_rate": 0.9896,
     "primary_share": {
      "m4a1_silencer": 0.373,
      "m4a1": 0.1914,
      "ak47": 0.1783,
      "awp": 0.1583,
      "mp9": 0.0542,
      "famas": 0.0244,
      "galilar": 0.01,
      "mp7": 0.0056
     },
     "secondary_share": {
      "usp_silencer": 0.7591,
      "fiveseven": 0.0729,
      "deagle": 0.0542,
      "tec9": 0.0331,
      "hkp2000": 0.0329
     },
     "awp_per_team": 0.7832,
     "grenades_per_player": {
      "smoke": 0.9568,
      "flash": 0.9069,
      "he": 0.8267,
      "molotov": 0.8399
     },
     "equip_value": {
      "p10": 4250,
      "p50": 5600,
      "p90": 7250
     }
    },
    "pistol": {
     "player_rounds": 1400,
     "armor_rate": 0.74,
     "helmet_rate": 0.0,
     "kit_rate": 0.0314,
     "primary_rate": 0.0,
     "primary_share": {},
     "secondary_share": {
      "usp_silencer": 0.7536,
      "elite": 0.2192,
      "hkp2000": 0.0272
     },
     "awp_per_team": 0.0,
     "grenades_per_player": {
      "smoke": 0.1614,
      "flash": 0.2457,
      "he": 0.0507,
      "molotov": 0.0136
     },
     "equip_value": {
      "p10": 600,
      "p50": 850,
      "p90": 1150
     }
    }
   },
   "T": {
    "eco": {
     "player_rounds": 1330,
     "armor_rate": 0.1496,
     "helmet_rate": 0.0406,
     "kit_rate": null,
     "primary_rate": 0.0278,
     "primary_share": {
      "ssg08": 0.4324,
      "ak47": 0.2703,
      "galilar": 0.1622,
      "xm1014": 0.0541,
      "awp": 0.0541,
      "m4a1": 0.027
     },
     "secondary_share": {
      "glock": 0.5881,
      "deagle": 0.2523,
      "tec9": 0.0956,
      "p250": 0.064
     },
     "awp_per_team": 0.0075,
     "grenades_per_player": {
      "smoke": 0.1406,
      "flash": 0.1075,
      "he": 0.0263,
      "molotov": 0.0113
     },
     "equip_value": {
      "p10": 200,
      "p50": 300,
      "p90": 1450
     }
    },
    "force": {
     "player_rounds": 1805,
     "armor_rate": 0.8748,
     "helmet_rate": 0.5679,
     "kit_rate": null,
     "primary_rate": 0.3208,
     "primary_share": {
      "galilar": 0.4283,
      "ak47": 0.3385,
      "mac10": 0.1313,
      "ssg08": 0.0466,
      "awp": 0.0311,
      "mp7": 0.0155,
      "m4a1_silencer": 0.0069,
      "xm1014": 0.0017
     },
     "secondary_share": {
      "tec9": 0.3957,
      "glock": 0.3879,
      "deagle": 0.1731,
      "p250": 0.0367,
      "usp_silencer": 0.0033
     },
     "awp_per_team": 0.0499,
     "grenades_per_player": {
      "smoke": 0.7025,
      "flash": 0.6393,
      "he": 0.0942,
      "molotov": 0.2476
     },
     "equip_value": {
      "p10": 1170,
      "p50": 2200,
      "p90": 3900
     }
    },
    "full": {
     "player_rounds": 10120,
     "armor_rate": 0.9971,
     "helmet_rate": 0.9794,